[Port4]  :  USB Composite Device


Is Port User Connectable:         yes
Is Port Debug Capable:            no
Companion Port Number:            4
Companion Hub Symbolic Link Name: USB#VID_0BDA&PID_0411#5&3846d5d7&0&19#{f18a0e88-c30c-11d0-8815-00a0c906bed8}
Protocols Supported:
 USB 1.1:                         yes
 USB 2.0:                         yes
 USB 3.0:                         no

Device Power State:               PowerDeviceD3

       ---===>Device Information<===---
String Descriptor for index 2 not available while device is in low power state.

ConnectionStatus:                  
Current Config Value:              0x01  -> Device Bus Speed: High (is not SuperSpeed or higher capable)
Device Address:                    0x0F
Open Pipes:                           1

          ===>Device Descriptor<===
bLength:                           0x12
bDescriptorType:                   0x01
bcdUSB:                          0x0200
bDeviceClass:                      0xEF  -> This is a Multi-interface Function Code Device
bDeviceSubClass:                   0x02  -> This is the Common Class Sub Class
bDeviceProtocol:                   0x01  -> This is the Interface Association Descriptor protocol
bMaxPacketSize0:                   0x40 = (64) Bytes
idVendor:                        0x2936 = LEAP Motion
idProduct:                       0x1202
bcdDevice:                       0x0333
iManufacturer:                     0x01
String Descriptor for index 1 not available while device is in low power state.
iProduct:                          0x02
String Descriptor for index 2 not available while device is in low power state.
iSerialNumber:                     0x04
String Descriptor for index 4 not available while device is in low power state.
bNumConfigurations:                0x01

          ---===>Open Pipes<===---

          ===>Endpoint Descriptor<===
bLength:                           0x07
bDescriptorType:                   0x05
bEndpointAddress:                  0x81  -> Direction: IN - EndpointID: 1
bmAttributes:                      0x02  -> Bulk Transfer Type
wMaxPacketSize:                  0x0200 = 0x200 max bytes
bInterval:                         0x00

       ---===>Full Configuration Descriptor<===---

          ===>Configuration Descriptor<===
bLength:                           0x09
bDescriptorType:                   0x02
wTotalLength:                    0x0172  -> Validated
bNumInterfaces:                    0x02
bConfigurationValue:               0x01
iConfiguration:                    0x00
bmAttributes:                      0x80  -> Bus Powered
MaxPower:                          0xFA = 500 mA

          ===>IAD Descriptor<===
bLength:                           0x08
bDescriptorType:                   0x0B
bFirstInterface:                   0x00
bInterfaceCount:                   0x02
bFunctionClass:                    0x0E  -> Video Interface Class
bFunctionSubClass:                 0x03  -> Video Interface Collection
bFunctionProtocol:                 0x00  -> PC_PROTOCOL_UNDEFINED protocol
iFunction:                         0x01
String Descriptor for index 1 not available while device is in low power state.

          ===>Interface Descriptor<===
bLength:                           0x09
bDescriptorType:                   0x04
bInterfaceNumber:                  0x00
bAlternateSetting:                 0x00
bNumEndpoints:                     0x00
bInterfaceClass:                   0x0E  -> Video Interface Class
bInterfaceSubClass:                0x01  -> Video Control Interface SubClass
bInterfaceProtocol:                0x00
iInterface:                        0x01
String Descriptor for index 1 not available while device is in low power state.

          ===>Class-Specific Video Control Interface Header Descriptor<===
bLength:                           0x0D
bDescriptorType:                   0x24
bDescriptorSubtype:                0x01
bcdVDC:                          0x0100
wTotalLength:                    0x006B  -> Validated
dwClockFreq:                 0x07735940 = (125000000) Hz
bInCollection:                     0x01
baInterfaceNr[1]:                  0x01
USB Video Class device: spec version 1.0

          ===>Video Control Input Terminal Descriptor<===
bLength:                           0x12
bDescriptorType:                   0x24
bDescriptorSubtype:                0x02
bTerminalID:                       0x01
wTerminalType:                   0x0201 = (ITT_CAMERA)
bAssocTerminal:                    0x00
iTerminal:                         0x02
String Descriptor for index 2 not available while device is in low power state.
===>Camera Input Terminal Data
wObjectiveFocalLengthMin:        0x0000
wObjectiveFocalLengthMax:        0x0000
wOcularFocalLength:              0x0000
bControlSize:                      0x03
bmControls : 0x00 0x00 0x00 
     D00 = 0   no -  Scanning Mode
     D01 = 0   no -  Auto-Exposure Mode
     D02 = 0   no -  Auto-Exposure Priority
     D03 = 0   no -  Exposure Time (Absolute)
     D04 = 0   no -  Exposure Time (Relative)
     D05 = 0   no -  Focus (Absolute)
     D06 = 0   no -  Focus (Relative)
     D07 = 0   no -  Iris (Absolute)
     D08 = 0   no -  Iris (Relative)
     D09 = 0   no -  Zoom (Absolute)
     D10 = 0   no -  Zoom (Relative)
     D11 = 0   no -  PanTilt (Absolute)
     D12 = 0   no -  PanTilt (Relative)
     D13 = 0   no -  Roll (Absolute)
     D14 = 0   no -  Roll (Relative)
     D15 = 0   no -  Reserved
     D16 = 0   no -  Reserved
     D17 = 0   no -  Focus, Auto
     D18 = 0   no -  Privacy
     D19 = 0   no -  Focus, Simple
     D20 = 0   no -  Window
     D21 = 0   no -  Region of Interest
     D22 = 0   no -  Reserved
     D23 = 0   no -  Reserved

          ===>Video Control Output Terminal Descriptor<===
bLength:                           0x09
bDescriptorType:                   0x24
bDescriptorSubtype:                0x03
bTerminalID:                       0x02
wTerminalType:                   0x0101 = (TT_STREAMING)
bAssocTerminal:                    0x00
bSourceID:                         0xE0
iTerminal:                         0x02
String Descriptor for index 2 not available while device is in low power state.

          ===>Video Control Processing Unit Descriptor<===
bLength:                           0x0C
bDescriptorType:                   0x24
bDescriptorSubtype:                0x05
bUnitID:                           0x03
bSourceID:                         0x01
wMaxMultiplier:                  0x0000
bControlSize:                      0x03
bmControls : 0x5F 0x06 0x00 
     D00 = 1  yes -  Brightness
     D01 = 1  yes -  Contrast
     D02 = 1  yes -  Hue
     D03 = 1  yes -  Saturation
     D04 = 1  yes -  Sharpness
     D05 = 0   no -  Gamma
     D06 = 1  yes -  White Balance Temperature
     D07 = 0   no -  White Balance Component
     D08 = 0   no -  Backlight Compensation
     D09 = 1  yes -  Gain
     D10 = 1  yes -  Power Line Frequency
     D11 = 0   no -  Hue, Auto
     D12 = 0   no -  White Balance Temperature, Auto
     D13 = 0   no -  White Balance Component, Auto
     D14 = 0   no -  Digital Multiplier
     D15 = 0   no -  Digital Multiplier Limit
     D16 = 0   no -  Analog Video Standard
     D17 = 0   no -  Analog Video Lock Status
     D18 = 0   no -  Contrast, Auto
     D19 = 0   no -  Reserved
     D20 = 0   no -  Reserved
     D21 = 0   no -  Reserved
     D22 = 0   no -  Reserved
     D23 = 0   no -  Reserved
iProcessing :                      0x02
String Descriptor for index 2 not available while device is in low power state.

          ===>Video Control Extension Unit Descriptor<===
bLength:                           0x1A
bDescriptorType:                   0x24
bDescriptorSubtype:                0x06
bUnitID:                           0x04
guidExtensionCode:                 {DD880F8A-1CBA-4954-8A25-F7875967F0F7}
bNumControls:                      0x02
bNrInPins:                         0x01
===>List of Connected Units and Terminal ID's
baSourceID[1]:                     0x03
bControlSize:                      0x01
bmControls : 0x03 
     D00 = 1  yes -  Vendor-Specific (Optional)
     D01 = 1  yes -  Vendor-Specific (Optional)
     D02 = 0   no -  Vendor-Specific (Optional)
     D03 = 0   no -  Vendor-Specific (Optional)
     D04 = 0   no -  Vendor-Specific (Optional)
     D05 = 0   no -  Vendor-Specific (Optional)
     D06 = 0   no -  Vendor-Specific (Optional)
     D07 = 0   no -  Vendor-Specific (Optional)
iExtension:                        0x02
String Descriptor for index 2 not available while device is in low power state.

          ===>Video Control Extension Unit Descriptor<===
bLength:                           0x1D
bDescriptorType:                   0x24
bDescriptorSubtype:                0x06
bUnitID:                           0xE0
guidExtensionCode:                 {9ADA33BC-8B9B-4B7F-A9D1-F3BC8C639029}
bNumControls:                      0x19
bNrInPins:                         0x01
===>List of Connected Units and Terminal ID's
baSourceID[1]:                     0x04
bControlSize:                      0x04
bmControls : 0xF4 0xC7 0xFF 0x7F 
     D00 = 0   no -  Vendor-Specific (Optional)
     D01 = 0   no -  Vendor-Specific (Optional)
     D02 = 1  yes -  Vendor-Specific (Optional)
     D03 = 0   no -  Vendor-Specific (Optional)
     D04 = 1  yes -  Vendor-Specific (Optional)
     D05 = 1  yes -  Vendor-Specific (Optional)
     D06 = 1  yes -  Vendor-Specific (Optional)
     D07 = 1  yes -  Vendor-Specific (Optional)
     D08 = 1  yes -  Vendor-Specific (Optional)
     D09 = 1  yes -  Vendor-Specific (Optional)
     D10 = 1  yes -  Vendor-Specific (Optional)
     D11 = 0   no -  Vendor-Specific (Optional)
     D12 = 0   no -  Vendor-Specific (Optional)
     D13 = 0   no -  Vendor-Specific (Optional)
     D14 = 1  yes -  Vendor-Specific (Optional)
     D15 = 1  yes -  Vendor-Specific (Optional)
     D16 = 1  yes -  Vendor-Specific (Optional)
     D17 = 1  yes -  Vendor-Specific (Optional)
     D18 = 1  yes -  Vendor-Specific (Optional)
     D19 = 1  yes -  Vendor-Specific (Optional)
     D20 = 1  yes -  Vendor-Specific (Optional)
     D21 = 1  yes -  Vendor-Specific (Optional)
     D22 = 1  yes -  Vendor-Specific (Optional)
     D23 = 1  yes -  Vendor-Specific (Optional)
     D24 = 1  yes -  Vendor-Specific (Optional)
     D25 = 1  yes -  Vendor-Specific (Optional)
     D26 = 1  yes -  Vendor-Specific (Optional)
     D27 = 1  yes -  Vendor-Specific (Optional)
     D28 = 1  yes -  Vendor-Specific (Optional)
     D29 = 1  yes -  Vendor-Specific (Optional)
     D30 = 1  yes -  Vendor-Specific (Optional)
     D31 = 0   no -  Vendor-Specific (Optional)
iExtension:                        0x02
String Descriptor for index 2 not available while device is in low power state.

          ===>Interface Descriptor<===
bLength:                           0x09
bDescriptorType:                   0x04
bInterfaceNumber:                  0x01
bAlternateSetting:                 0x00
bNumEndpoints:                     0x01
bInterfaceClass:                   0x0E  -> Video Interface Class
bInterfaceSubClass:                0x02  -> Video Streaming Interface SubClass
bInterfaceProtocol:                0x00
iInterface:                        0x00

          ===>Endpoint Descriptor<===
bLength:                           0x07
bDescriptorType:                   0x05
bEndpointAddress:                  0x81  -> Direction: IN - EndpointID: 1
bmAttributes:                      0x02  -> Bulk Transfer Type
wMaxPacketSize:                  0x0200 = 0x200 max bytes
bInterval:                         0x00

          ===>Video Class-Specific VS Video Input Header Descriptor<===
bLength:                           0x0E
bDescriptorType:                   0x24
bDescriptorSubtype:                0x01
bNumFormats:                       0x01
wTotalLength:                    0x00DD  -> Validated
bEndpointAddress:                  0x81  -> Direction: IN - EndpointID: 1
bmInfo:                            0x00  -> Dynamic Format Change not Supported
bTerminalLink:                     0x02
bStillCaptureMethod:               0x00  -> No Still Capture
bTriggerSupport:                   0x00  -> No Hardware Triggering Support
bTriggerUsage:                     0x00
bControlSize:                      0x01
Video Payload Format 1             0x00 
     D00 = 0   no -  Key Frame Rate
     D01 = 0   no -  P Frame Rate
     D02 = 0   no -  Compression Quality
     D03 = 0   no -  Compression Window Size
     D04 = 0   no -  Generate Key Frame
     D05 = 0   no -  Update Frame Segment
     D06 = 0   no -  Reserved
     D07 = 0   no -  Reserved

          ===>Video Streaming Uncompressed Format Type Descriptor<===
bLength:                           0x1B
bDescriptorType:                   0x24
bDescriptorSubtype:                0x04
bFormatIndex:                      0x01
bNumFrameDescriptors:              0x06
guidFormat:                        {32595559-0000-0010-8000-00AA00389B71} = YUY2 Format
bBitsPerPixel:                     0x10
bDefaultFrameIndex:                0x01
bAspectRatioX:                     0x00
bAspectRatioY:                     0x00
bmInterlaceFlags:                  0x00
     D0    = 0x00 Interlaced stream or variable: No
     D1    = 0x00 Fields per frame: 2 fields
     D2    = 0x00 Field 1 first: No
     D3    = 0x00 Reserved
     D4..5 = 0x00 Field patterns  -> Field 1 only
     D6..7 = 0x00 Display Mode  -> Bob only
bCopyProtect:                      0x00  -> Duplication Unrestricted
*!*ERROR:  no Color Matching Descriptor for this format

          ===>Video Streaming Uncompressed Frame Type Descriptor<===
          --->This is the Default (optimum) Frame index
bLength:                           0x1E
bDescriptorType:                   0x24
bDescriptorSubtype:                0x05
bFrameIndex:                       0x01
bmCapabilities:                    0x00
wWidth:                          0x0280 = 640
wHeight:                         0x01E0 = 480
dwMinBitRate:                0x0D2F0000
dwMaxBitRate:                0x0D2F0000
dwMaxVideoFrameBufferSize:   0x00096000
dwDefaultFrameInterval:      0x0003640E = 22.222200 mSec (45.00 Hz)
bFrameIntervalType:                0x01
===>Additional Discrete Frame Type Data
dwFrameInterval[1]:          0x0003640E = 22.222200 mSec (45.00 Hz)

          ===>Video Streaming Uncompressed Frame Type Descriptor<===
bLength:                           0x1E
bDescriptorType:                   0x24
bDescriptorSubtype:                0x05
bFrameIndex:                       0x02
bmCapabilities:                    0x00
wWidth:                          0x02A8 = 680
wHeight:                         0x011E = 286
dwMinBitRate:                0x0CFBA200
dwMaxBitRate:                0x0CFBA200
dwMaxVideoFrameBufferSize:   0x0005EF60
dwDefaultFrameInterval:      0x00022E09 = 14.285700 mSec (70.00 Hz)
bFrameIntervalType:                0x01
===>Additional Discrete Frame Type Data
dwFrameInterval[1]:          0x00022E09 = 14.285700 mSec (70.00 Hz)

          ===>Video Streaming Uncompressed Frame Type Descriptor<===
bLength:                           0x1E
bDescriptorType:                   0x24
bDescriptorSubtype:                0x05
bFrameIndex:                       0x03
bmCapabilities:                    0x00
wWidth:                          0x0320 = 800
wHeight:                         0x0320 = 800
dwMinBitRate:                0x0EA60000
dwMaxBitRate:                0x0EA60000
dwMaxVideoFrameBufferSize:   0x00138800
dwDefaultFrameInterval:      0x00065B9A = 41.666600 mSec (24.00 Hz)
bFrameIntervalType:                0x01
===>Additional Discrete Frame Type Data
dwFrameInterval[1]:          0x00065B9A = 41.666600 mSec (24.00 Hz)

          ===>Video Streaming Uncompressed Frame Type Descriptor<===
bLength:                           0x1E
bDescriptorType:                   0x24
bDescriptorSubtype:                0x05
bFrameIndex:                       0x04
bmCapabilities:                    0x00
wWidth:                          0x0190 = 400
wHeight:                         0x0190 = 400
dwMinBitRate:                0x0CF85000
dwMaxBitRate:                0x0CF85000
dwMaxVideoFrameBufferSize:   0x0004E200
dwDefaultFrameInterval:      0x0001CB8F = 11.764700 mSec (85.00 Hz)
bFrameIntervalType:                0x01
===>Additional Discrete Frame Type Data
dwFrameInterval[1]:          0x0001CB8F = 11.764700 mSec (85.00 Hz)

          ===>Video Streaming Uncompressed Frame Type Descriptor<===
bLength:                           0x1E
bDescriptorType:                   0x24
bDescriptorSubtype:                0x05
bFrameIndex:                       0x05
bmCapabilities:                    0x00
wWidth:                          0x0180 = 384
wHeight:                         0x0180 = 384
dwMinBitRate:                0x0CA80000
dwMaxBitRate:                0x0CA80000
dwMaxVideoFrameBufferSize:   0x00048000
dwDefaultFrameInterval:      0x0001B207 = 11.111100 mSec (90.00 Hz)
bFrameIntervalType:                0x01
===>Additional Discrete Frame Type Data
dwFrameInterval[1]:          0x0001B207 = 11.111100 mSec (90.00 Hz)

          ===>Video Streaming Uncompressed Frame Type Descriptor<===
bLength:                           0x1E
bDescriptorType:                   0x24
bDescriptorSubtype:                0x05
bFrameIndex:                       0x06
bmCapabilities:                    0x00
wWidth:                          0x0170 = 368
wHeight:                         0x0170 = 368
dwMinBitRate:                0x0CEA4000
dwMaxBitRate:                0x0CEA4000
dwMaxVideoFrameBufferSize:   0x00042200
dwDefaultFrameInterval:      0x000186A0 = 10.000000 mSec (100.00 Hz)
bFrameIntervalType:                0x01
===>Additional Discrete Frame Type Data
dwFrameInterval[1]:          0x000186A0 = 10.000000 mSec (100.00 Hz)

          ===>Additional Error Checking<===
PASS: number of uncompressed-frame frame descriptors (6) == number of frame descriptors (6) specified in uncompressed format descriptor(s)
